{
  "id": "018f8a10-4c2b-7d3e-9f10-2a3b4c5d6e7f",
  "type": "control.heartbeat",
  "source": "timing",
  "schemaVersion": 1,
  "envelopeVersion": 1,
  "occurredAt": "2026-05-31T13:45:00.000Z",
  "correlationId": "7c9e6a55-0e42-4f8b-bd1a-3c2d1e0f9a8b",
  "causationId": null,
  "data": {
    "service": "timing",
    "at": "2026-05-31T13:45:00.000Z",
    "instanceId": "b3d4e5f6-1a2b-4c3d-8e9f-0a1b2c3d4e5f"
  }
}
