{
  "id": "e9b4f3d5-2a6c-4b8a-bf43-5d7e9a1b3c45",
  "type": "privacy.erasure_requested",
  "source": "frontend",
  "schemaVersion": 1,
  "envelopeVersion": 1,
  "occurredAt": "2026-06-01T11:30:00.000Z",
  "correlationId": "e9b4f3d5-2a6c-4b8a-bf43-5d7e9a1b3c45",
  "causationId": null,
  "data": {
    "requestId": "e9b4f3d5-2a6c-4b8a-bf43-5d7e9a1b3c45",
    "masterId": "1a9f7c20-3e84-4d11-9aa2-7b6c5e4d3f21",
    "requestedBy": "self",
    "adminActor": null,
    "at": "2026-06-01T11:30:00.000Z"
  }
}
