{
  "id": "018f7b3a-1c52-7f8b-9a4d-2b3c4d5e6f70",
  "type": "session.ended",
  "source": "timing",
  "schemaVersion": 1,
  "envelopeVersion": 1,
  "occurredAt": "2026-05-31T14:05:00.000Z",
  "correlationId": "8b2e0d44-1f6a-4b9c-9e23-2c7a1f0b3d55",
  "causationId": null,
  "data": {
    "sessionId": "session-2026-05-31-evening-heat-3",
    "endedAt": "2026-05-31T14:05:00.000Z",
    "summary": [
      {
        "masterId": "1a9f7c20-3e84-4d11-9aa2-7b6c5e4d3f21",
        "bestLapMs": 41980,
        "lapCount": 12
      }
    ]
  }
}
