{
  "id": "018f4b3e-7c2a-7b1d-9e4a-2f6c8d0a1b3e",
  "type": "driver.profile_updated",
  "source": "driver",
  "schemaVersion": 1,
  "envelopeVersion": 1,
  "occurredAt": "2026-06-01T10:05:01.000Z",
  "correlationId": "d8a3e2c4-1f5b-4a79-ae32-4c6d8f0a2b34",
  "causationId": "b2e7c6a8-5d9f-4e1d-9c76-8a0b2d4e6f78",
  "data": {
    "masterId": "1a9f7c20-3e84-4d11-9aa2-7b6c5e4d3f21",
    "racingNumber": "27",
    "kartClass": "senior",
    "nickname": "Sofie-S"
  }
}
