{
  "id": "018f7a2c-9d3e-7c41-b8a2-1e6f4d2c5b09",
  "type": "driver.checked_in",
  "source": "timing",
  "schemaVersion": 1,
  "envelopeVersion": 1,
  "occurredAt": "2026-05-31T13:58:02.140Z",
  "correlationId": "8b2e0d44-1f6a-4b9c-9e23-2c7a1f0b3d55",
  "causationId": null,
  "data": {
    "masterId": "1a9f7c20-3e84-4d11-9aa2-7b6c5e4d3f21",
    "at": "2026-05-31T13:58:02.140Z",
    "checkInMethod": "qr",
    "transponderId": null
  }
}
